[
  {
    "call_id": "0ac6dffb-bd15-4829-b96d-e2c1abe61d3a",
    "policyholder_id": "8349345c-a6c5-4bf9-8ebb-6bbfc1628715",
    "claim_id": null,
    "created_at": "2017-11-26T11:14:59.777Z",
    "call_status": "completed",
    "direction": "inbound",
    "from_number": "+27823378000",
    "to_number": "+27821234567",
    "topic": "general",
    "recording_url": "https://recordingurl.com",
    "call_duration": "5"
  }
]